{"id":"concept://demo/edge/00000000000000000000000005","namespace":"demo","family":"neighborhood","relation":"contains","source_uri":"concept://demo/semantic-neighborhood/00000000000000000000000000","target_uri":"concept://demo/concept/00000000000000000000000000","schema_version":1,"payload":{"rank":1,"component_distances":{"semantic":"0.10"},"aggregate_distance":"0.10","why":[{"uri":"concept://demo/concept/00000000000000000000000000","family":"neighborhood","relation":"contains"}]},"provenance_refs":["1212121212121212121212121212121212121212121212121212121212121212"],"recorded_at":"2026-09-04T21:05:00Z"}

